{
  "version": "0.1.0",
  "last_updated": "2026-08-04",
  "status": "developing_doctrine_architecture",
  "decision_ids": ["CC-DEC-062", "CC-DEC-063"],
  "domain_title": "Community Food Security System",
  "research_domain_title": "Local Food Capacity, Regional Networks, Value-Added Production, and Food Resilience",
  "website_node_id": "CC-WEB-AGRICULTURE",
  "note": "Broad system architecture for testing multiple models — not a commitment to one food-network structure. Regional Food Network, State Food Exchange, and Community Food Dashboard are design agendas, not operating products. No invented local-sourcing percentages, farmer-income figures, or food-waste statistics. Explicitly rejects an export-only rule for mass-produced staples. Detailed statutes blocked until Phase 2.1 sourced modules.",
  "role_in_philosophy": "Food is critical infrastructure and a strategic community asset. Local resilience comes first, regional cooperation second, and national and international trade as complementary strengths — not replacements for strong community food systems. This broadens a single food-network idea into a Community Food Security System that can incorporate and test different models.",
  "rejected_principle": {
    "text": "Mass production food becomes export only items.",
    "reason": "Large-scale agriculture often produces staple foods efficiently and helps stabilize supply when local harvests fail because of drought, floods, pests, or disease. Making export-only a core principle creates unnecessary isolation and weakens resilience.",
    "doctrine_ids": ["CC-DEV-058"]
  },
  "central_principle": {
    "text": "Every community should have the capacity to provide a meaningful share of its essential food needs while remaining connected to broader markets that increase resilience and economic opportunity.",
    "doctrine_ids": ["CC-DEV-058"]
  },
  "local_first_export_second": {
    "text": "Communities should have the opportunity to meet local demand before relying exclusively on distant markets, while producers remain free to participate in broader markets.",
    "not": "A prohibition on exports.",
    "is": "An encouragement of strong local food systems.",
    "doctrine_ids": ["CC-DEV-058", "CC-DEV-059"]
  },
  "governing_doctrine": {
    "text": "Food is a strategic community asset. A prosperous constitutional republic strengthens local food production, supports efficient regional distribution, rewards stewardship of the land, reduces waste, and ensures that every community has reliable access to affordable, nutritious food while remaining connected to wider markets that provide resilience and economic opportunity.",
    "doctrine_ids": ["CC-DEV-058"]
  },
  "food_as_critical_infrastructure": {
    "summary": "Food should be viewed as critical infrastructure. Just as a community needs roads, water, electricity, and broadband, it should also have a strategy for fresh food, emergency reserves, local processing, regional distribution, and nutrition. Food security becomes part of public resilience.",
    "parallel_infrastructure": [
      "roads",
      "water",
      "electricity",
      "broadband"
    ],
    "food_strategy_includes": [
      "fresh food",
      "emergency reserves",
      "local processing",
      "regional distribution",
      "nutrition"
    ],
    "federal_definition_note": "USDA ERS defines food security as access by all people at all times to enough food for an active, healthy life — a household/community access concept that Constitutional Capitalism extends into place-based production, processing, and resilience capacity without inventing insecurity rates here.",
    "source_ids": ["CC-SRC-037"],
    "doctrine_ids": ["CC-DEV-058"]
  },
  "system_posture": {
    "summary": "A Community Food Security System gives room to incorporate different models and test what works, rather than committing to one structure from the beginning.",
    "layers": [
      "local resilience first",
      "regional cooperation second",
      "national and international trade as complementary strengths"
    ],
    "doctrine_ids": ["CC-DEV-058"]
  },
  "regional_food_network": {
    "status": "design_agenda",
    "summary": "Imagine the state divided into regional food districts that cooperate rather than compete for basic food needs.",
    "illustrative_geography": "Arkansas regional food districts are one possible state application — portable doctrine, not a locked statewide map.",
    "each_district_includes": [
      "family farms",
      "orchards",
      "livestock producers",
      "dairies",
      "fisheries where applicable",
      "greenhouses",
      "community gardens",
      "food processors",
      "cold storage",
      "distribution hubs"
    ],
    "goal": "Communities cooperate rather than compete for basic food needs.",
    "federal_context_note": "USDA programs supporting local and regional food markets, value-added products, and food-system infrastructure (including LAMP/food-hub related work) illustrate federal recognition of aggregation, distribution, and market-access tools — not a finished Constitutional Capitalism exchange design.",
    "source_ids": ["CC-SRC-039"],
    "doctrine_ids": ["CC-DEV-059"]
  },
  "state_food_exchange": {
    "status": "design_agenda",
    "summary": "Not government running grocery stores. Government creating logistics infrastructure — a transparent marketplace where farmers list available products and schools, hospitals, senior centers, food banks, restaurants, retailers, cooperatives, and communities can purchase.",
    "is": "a logistics platform",
    "is_not": "government grocery stores",
    "participants": [
      "farmers",
      "schools",
      "hospitals",
      "senior centers",
      "food banks",
      "restaurants",
      "retailers",
      "cooperatives",
      "communities"
    ],
    "aims": [
      "reduce waste",
      "improve market access for small producers",
      "increase transparency"
    ],
    "doctrine_ids": ["CC-DEV-059"]
  },
  "keep_value_local": {
    "summary": "One of the biggest problems is that communities often export raw products and import finished food. Constitutional Capitalism should encourage more local value-added production so more jobs and income remain in rural communities.",
    "value_chain_example": [
      "Grow tomatoes",
      "Wash",
      "Package",
      "Can",
      "Make salsa",
      "Sell locally first",
      "Export the surplus"
    ],
    "source_ids": ["CC-SRC-039"],
    "doctrine_ids": ["CC-DEV-059"]
  },
  "fresh_food_networks": {
    "summary": "Every county could support partnerships that connect farms with schools, hospitals, correctional facilities, universities, nursing homes, and food banks — shortening supply chains and creating dependable markets for local producers.",
    "partners": [
      "farms",
      "schools",
      "hospitals",
      "correctional facilities",
      "universities",
      "nursing homes",
      "food banks"
    ],
    "doctrine_ids": ["CC-DEV-059"]
  },
  "reduce_food_waste": {
    "summary": "The philosophy should treat wasted food as wasted human effort. Create systems where surplus food can quickly move to food banks, shelters, schools, community kitchens, and emergency reserves. Technology can match surplus with nearby demand.",
    "surplus_destinations": [
      "food banks",
      "shelters",
      "schools",
      "community kitchens",
      "emergency reserves"
    ],
    "federal_context_note": "EPA’s Wasted Food Scale prioritizes preventing waste, donation, and upcycling before less preferred disposal pathways — supporting surplus-to-nourishment systems without inventing national waste percentages as doctrine claims.",
    "source_ids": ["CC-SRC-038"],
    "doctrine_ids": ["CC-DEV-060"]
  },
  "community_food_reserves": {
    "status": "design_agenda",
    "summary": "Every region should maintain emergency food capacity — not to replace private markets, but to prepare for natural disasters, transportation disruptions, pandemics, and major crop failures. Resilience is part of prosperity.",
    "prepares_for": [
      "natural disasters",
      "transportation disruptions",
      "pandemics",
      "major crop failures"
    ],
    "not": "a replacement for private markets",
    "doctrine_ids": ["CC-DEV-060"]
  },
  "regenerative_agriculture_link": {
    "summary": "Farmers who improve soil health, water quality, biodiversity, and carbon storage could receive payments tied to verified public benefits — aligning environmental stewardship with farm profitability. Connects directly to Resource Sovereignty’s Local Carbon Restoration Exchange.",
    "related_framework": "data/project/resource_sovereignty_framework.json",
    "related_doctrine_ids": ["CC-DEV-057"],
    "source_ids": ["CC-SRC-034", "CC-SRC-035"],
    "doctrine_ids": ["CC-DEV-060"]
  },
  "food_education": {
    "summary": "Schools and rural academies should teach gardening, soil science, nutrition, food preservation, livestock management, business planning, and food safety. The goal is not that everyone becomes a farmer — it is that every citizen understands where food comes from and how communities remain food secure.",
    "topics": [
      "gardening",
      "soil science",
      "nutrition",
      "food preservation",
      "livestock management",
      "business planning",
      "food safety"
    ],
    "related_framework": "data/project/human_capital_framework.json",
    "doctrine_ids": ["CC-DEV-061"]
  },
  "community_food_dashboard": {
    "status": "design_agenda",
    "summary": "A Community Food Dashboard could track measurable outcomes so communities improve based on evidence rather than assumptions. Indicator slots only until sourced; no invented values.",
    "candidate_indicators": [
      "percentage of food sourced locally or regionally",
      "fresh-food access",
      "food affordability",
      "farmer income",
      "food waste",
      "emergency reserve capacity",